id,level,name,txt1,txt2,icon,mod,scale,bbackground,sbackground,skill1,skill2,skill3,timereset,challenge,nextid,hurtparameter
1,1001,荒火骑士,罪业的荒火，弑君的骑士,巨龙裹挟着仇恨的吐息，欲将万物焚为灰烬,1001,1001,10000,100101,100102,100101,100102,100103,21,5,2,10000
2,1002,凋零使者,阴霾笼罩，万物凋零,蠢蠢欲动的邪灵，是绿萌丛中的倒影,1002,1002,10000,100201,100202,100201,100202,100203,22,5,3,10000
3,1003,梦魇之触,噩梦深处，心魔寄生,永生不死的欲念之触，将万物拖入无尽深渊,1003,1003,10000,100301,100302,100301,100302,100303,23,5,4,10000
4,1004,霜魂女妖,凄风骤起，霜魂呼嚎,苍白的魅影于风雪之中若隐若现……,1004,1004,10000,100401,100402,100401,100402,100403,24,5,5,10000
5,1005,年兽,虚空洞开，烈焰炽灼,来自神秘国度的凶兽，祸及之地皆为焦土,1005,1005,10000,100501,100502,100501,100502,100503,25,5,1,10000
